Question,Correct Answer,Wrong Answer 1,Wrong Answer 2,Wrong Answer 3
What type of medication is Bupropion?,Antidepressant,Opioid,Benzodiazepine,Stimulant only
What is a street name sometimes associated with misused Bupropion?,Poor man’s cocaine,Uppers,Z-bar,Blue buzz
True or False: Crushing and snorting Bupropion increases seizure risk.,True,False,,
How should Bupropion be stored?,"In a secure, childproof container",In the fridge,In sunlight,On the bathroom counter
What makes Bupropion different from most antidepressants?,It does not usually cause sexual side effects,It’s taken intravenously,It causes hallucinations,It works instantly
