Question,Correct Answer,Wrong Answer 1,Wrong Answer 2,Wrong Answer 3
Ecstasy is chemically similar to which drug type?,Stimulants and hallucinogens,Painkillers,Antidepressants,Beta-blockers
What dangerous condition can result from overheating while on Ecstasy?,Heatstroke,Cold sweats,Muscle cramps,Low blood sugar
What is a common after-effect of MDMA use?,Depression and fatigue,Increased intelligence,Weight gain,Better reflexes
Why is MDMA especially risky at parties or raves?,High temperatures and dehydration amplify risks,There are no risks,It helps people dance better,It prevents dehydration
True or False: MDMA can be laced with other harmful substances.,True,False,,
